{
  "nativeId": "ILS_Ceramide_RingTrial_DB_Filt",
  "title": "Ceramide Concentrations - NIST RM 8231 Diabetic (DB) Matrix - Filt Labs",
  "description": "Consensus concentration values with outliers removed for NIST RM 8231 Diabetic (DB) matrix samples from the interlaboratory comparison study. Outliers were removed based on Tukey's 1.5 × IQR fences, represented and determined separately for each of the four ceramides and reference materials.",
  "controlledVocabularies": [
    {
      "name": "Ontology for Biomedical Investigations",
      "uri": "http://purl.obolibrary.org/obo/obi",
      "version": "2026-05-08",
      "cvLabel": "OBI"
    },
    {
      "name": "National Cancer Institute Thesaurus",
      "uri": "http://purl.obolibrary.org/obo/ncit.owl",
      "version": "03-12-2019",
      "cvLabel": "NCIT"
    }
  ],
  "studyDesign": {
    "accession": "OBI:0003658",
    "name": "study design type",
    "value": "ring trial design",
    "cvLabel": "OBI"
  },
  "publicationMetadata": {
    "title": "Concordant inter-laboratory derived concentrations of ceramides in human plasma reference materials via authentic standards",
    "authors": [
      "Federico Torta",
      "Nils Hoffmann",
      "Bo Burla",
      "Irina Alecu",
      "Makoto Arita",
      "Takeshi Bamba",
      "Steffany A. L. Bennett",
      "Justine Bertrand-Michel",
      "Britta Brügger",
      "Mónica P. Cala",
      "Dolores Camacho-Muñoz",
      "Antonio Checa",
      "Michael Chen",
      "Michaela Chocholoušková",
      "Michelle Cinel",
      "Emeline Chu-Van",
      "Benoit Colsch",
      "Cristina Coman",
      "Lisa Connell",
      "Bebiana C. Sousa",
      "Alex M. Dickens",
      "Maria Fedorova",
      "Finnur Freyr Eiríksson",
      "Hector Gallart-Ayala",
      "Mohan Ghorasaini",
      "Martin Giera",
      "Xue Li Guan",
      "Mark Haid",
      "Thomas Hankemeier",
      "Amy Harms",
      "Marcus Höring",
      "Michal Holčapek",
      "Thorsten Hornemann",
      "Chunxiu Hu",
      "Andreas J. Hülsmeier",
      "Kevin Huynh",
      "Christina M. Jones",
      "Julijana Ivanisevic",
      "Yoshihiro Izumi",
      "Harald C. Köfeler",
      "Sin Man Lam",
      "Mike Lange",
      "Jong Cheol Lee",
      "Gerhard Liebisch",
      "Katrice Lippa",
      "Andrea F. Lopez-Clavijo",
      "Malena Manzi",
      "Manuela R. Martinefski",
      "Raviswamy G. H. Math",
      "Satyajit Mayor",
      "Peter J. Meikle",
      "María Eugenia Monge",
      "Myeong Hee Moon",
      "Sneha Muralidharan",
      "Anna Nicolaou",
      "Thao Nguyen-Tran",
      "Valerie B. O'Donnell",
      "Matej Orešič",
      "Arvind Ramanathan",
      "Fabien Riols",
      "Daisuke Saigusa",
      "Tracey B. Schock",
      "Heidi Schwartz-Zimmermann",
      "Guanghou Shui",
      "Madhulika Singh",
      "Masatomo Takahashi",
      "Margrét Thorsteinsdóttir",
      "Noriyuki Tomiyasu",
      "Anthony Tournadre",
      "Hiroshi Tsugawa",
      "Victoria J. Tyrrell",
      "Grace van der Gugten",
      "Michael O. Wakelam",
      "Craig E. Wheelock",
      "Denise Wolrab",
      "Guowang Xu",
      "Tianrun Xu",
      "John A. Bowden",
      "Kim Ekroos",
      "Robert Ahrends",
      "Markus R. Wenk"
    ],
    "year": 2024,
    "doi": "10.1038/s41467-024-52087-x",
    "description": "Nature Communications publication of the interlaboratory ceramide ring trial study"
  },
  "lipidSummarizedQuantities": [
    {
      "lipids": [
        "Cer 18:1;O2/16:0"
      ],
      "quantityUnit": {
        "accession": "UO:0000276",
        "name": "micromole per liter",
        "cvLabel": "UO"
      },
      "groupingAttributes": {
        "sampleMatrix": {
          "accession": "OBI:0000747",
          "name": "material sample",
          "value": "NIST RM 8231 Diabetic (DB)",
          "cvLabel": "OBI"
        },
        "dataType": {
          "accession": "OBI:0001755",
          "name": "selection criterion",
          "value": "Without Outliers",
          "cvLabel": "OBI"
        }
      },
      "stats": {
        "n": 35,
        "mean": 0.21606123922577267,
        "sd": 0.030910505078260254,
        "median": 0.2155067415402352,
        "cv": 14.306362950163587,
        "rcv": 12.820746716942194
      }
    },
    {
      "lipids": [
        "Cer 18:1;O2/18:0"
      ],
      "quantityUnit": {
        "accession": "UO:0000276",
        "name": "micromole per liter",
        "cvLabel": "UO"
      },
      "groupingAttributes": {
        "sampleMatrix": {
          "accession": "OBI:0000747",
          "name": "material sample",
          "value": "NIST RM 8231 Diabetic (DB)",
          "cvLabel": "OBI"
        },
        "dataType": {
          "accession": "OBI:0001755",
          "name": "selection criterion",
          "value": "Without Outliers",
          "cvLabel": "OBI"
        }
      },
      "stats": {
        "n": 32,
        "mean": 0.09655121465500752,
        "sd": 0.011369954464656488,
        "median": 0.0974817876934504,
        "cv": 11.776086406870283,
        "rcv": 10.146031848467421
      }
    },
    {
      "lipids": [
        "Cer 18:1;O2/24:0"
      ],
      "quantityUnit": {
        "accession": "UO:0000276",
        "name": "micromole per liter",
        "cvLabel": "UO"
      },
      "groupingAttributes": {
        "sampleMatrix": {
          "accession": "OBI:0000747",
          "name": "material sample",
          "value": "NIST RM 8231 Diabetic (DB)",
          "cvLabel": "OBI"
        },
        "dataType": {
          "accession": "OBI:0001755",
          "name": "selection criterion",
          "value": "Without Outliers",
          "cvLabel": "OBI"
        }
      },
      "stats": {
        "n": 36,
        "mean": 2.4012645742526755,
        "sd": 0.28471318410007285,
        "median": 2.428917736526701,
        "cv": 11.856801918159379,
        "rcv": 9.659093370570213
      }
    },
    {
      "lipids": [
        "Cer 18:1;O2/24:1"
      ],
      "quantityUnit": {
        "accession": "UO:0000276",
        "name": "micromole per liter",
        "cvLabel": "UO"
      },
      "groupingAttributes": {
        "sampleMatrix": {
          "accession": "OBI:0000747",
          "name": "material sample",
          "value": "NIST RM 8231 Diabetic (DB)",
          "cvLabel": "OBI"
        },
        "dataType": {
          "accession": "OBI:0001755",
          "name": "selection criterion",
          "value": "Without Outliers",
          "cvLabel": "OBI"
        }
      },
      "stats": {
        "n": 33,
        "mean": 0.866302164374892,
        "sd": 0.09960869815406961,
        "median": 0.8662642189929819,
        "cv": 11.49814721124995,
        "rcv": 7.782184229917031
      }
    }
  ],
  "visibility": "PUBLIC"
}