{
  "nativeId": "ILS_Ceramide_RingTrial_hTAG_All",
  "title": "Ceramide Concentrations - hTAG Matrix - All Labs",
  "description": "Consensus concentration values across all labs for hTAG matrix samples from the interlaboratory comparison study",
  "controlledVocabularies": [
    {
      "name": "Ontology for Biomedical Investigations",
      "uri": "https://obi-ontology.org/",
      "version": "2024-07-11",
      "cvLabel": "OBI"
    },
    {
      "name": "Unit Ontology",
      "uri": "https://www.ebi.ac.uk/ontology-units/",
      "version": "2024-07-11",
      "cvLabel": "UO"
    }
  ],
  "studyDesign": {
    "accession": "OBI:0003658",
    "name": "study design type",
    "value": "ring trial design",
    "cvLabel": "OBI"
  },
  "publicationMetadata": {
    "title": "Concordant inter-laboratory derived concentrations of ceramides in human plasma reference materials via authentic standards",
    "authors": [
      "Federico Torta",
      "Nils Hoffmann",
      "Bo Burla",
      "Irina Alecu",
      "Makoto Arita",
      "Takeshi Bamba",
      "Steffany A. L. Bennett",
      "Justine Bertrand-Michel",
      "Britta Brügger",
      "Mónica P. Cala",
      "Dolores Camacho-Muñoz",
      "Antonio Checa",
      "Michael Chen",
      "Michaela Chocholoušková",
      "Michelle Cinel",
      "Emeline Chu-Van",
      "Benoit Colsch",
      "Cristina Coman",
      "Lisa Connell",
      "Bebiana C. Sousa",
      "Alex M. Dickens",
      "Maria Fedorova",
      "Finnur Freyr Eiríksson",
      "Hector Gallart-Ayala",
      "Mohan Ghorasaini",
      "Martin Giera",
      "Xue Li Guan",
      "Mark Haid",
      "Thomas Hankemeier",
      "Amy Harms",
      "Marcus Höring",
      "Michal Holčapek",
      "Thorsten Hornemann",
      "Chunxiu Hu",
      "Andreas J. Hülsmeier",
      "Kevin Huynh",
      "Christina M. Jones",
      "Julijana Ivanisevic",
      "Yoshihiro Izumi",
      "Harald C. Köfeler",
      "Sin Man Lam",
      "Mike Lange",
      "Jong Cheol Lee",
      "Gerhard Liebisch",
      "Katrice Lippa",
      "Andrea F. Lopez-Clavijo",
      "Malena Manzi",
      "Manuela R. Martinefski",
      "Raviswamy G. H. Math",
      "Satyajit Mayor",
      "Peter J. Meikle",
      "María Eugenia Monge",
      "Myeong Hee Moon",
      "Sneha Muralidharan",
      "Anna Nicolaou",
      "Thao Nguyen-Tran",
      "Valerie B. O'Donnell",
      "Matej Orešič",
      "Arvind Ramanathan",
      "Fabien Riols",
      "Daisuke Saigusa",
      "Tracey B. Schock",
      "Heidi Schwartz-Zimmermann",
      "Guanghou Shui",
      "Madhulika Singh",
      "Masatomo Takahashi",
      "Margrét Thorsteinsdóttir",
      "Noriyuki Tomiyasu",
      "Anthony Tournadre",
      "Hiroshi Tsugawa",
      "Victoria J. Tyrrell",
      "Grace van der Gugten",
      "Michael O. Wakelam",
      "Craig E. Wheelock",
      "Denise Wolrab",
      "Guowang Xu",
      "Tianrun Xu",
      "John A. Bowden",
      "Kim Ekroos",
      "Robert Ahrends",
      "Markus R. Wenk"
    ],
    "year": 2024,
    "doi": "10.1038/s41467-024-52087-x",
    "description": "Nature Communications publication of the interlaboratory ceramide ring trial study"
  },
  "lipidSummarizedQuantities": [
    {
      "lipids": [
        "Cer 18:1;O2/16:0"
      ],
      "quantityUnit": {
        "accession": "UO:0000276",
        "name": "micromole per liter",
        "cvLabel": "UO"
      },
      "groupingAttributes": {
        "sampleMatrix": {
          "accession": "OBI:0000747",
          "name": "material sample",
          "value": "hTAG",
          "cvLabel": "OBI"
        },
        "dataType": {
          "accession": "OBI:0001755",
          "name": "selection criterion",
          "value": "All",
          "cvLabel": "OBI"
        }
      },
      "stats": {
        "n": 39,
        "mean": 0.29137774087262697,
        "sd": 0.06674952806951219,
        "median": 0.2902270384390738,
        "cv": 22.90824545128556,
        "rcv": 13.205635185110282
      }
    },
    {
      "lipids": [
        "Cer 18:1;O2/18:0"
      ],
      "quantityUnit": {
        "accession": "UO:0000276",
        "name": "micromole per liter",
        "cvLabel": "UO"
      },
      "groupingAttributes": {
        "sampleMatrix": {
          "accession": "OBI:0000747",
          "name": "material sample",
          "value": "hTAG",
          "cvLabel": "OBI"
        },
        "dataType": {
          "accession": "OBI:0001755",
          "name": "selection criterion",
          "value": "All",
          "cvLabel": "OBI"
        }
      },
      "stats": {
        "n": 39,
        "mean": 0.100420797899625,
        "sd": 0.027401539949903037,
        "median": 0.09935406863544768,
        "cv": 27.286718013625105,
        "rcv": 11.211523204458366
      }
    },
    {
      "lipids": [
        "Cer 18:1;O2/24:0"
      ],
      "quantityUnit": {
        "accession": "UO:0000276",
        "name": "micromole per liter",
        "cvLabel": "UO"
      },
      "groupingAttributes": {
        "sampleMatrix": {
          "accession": "OBI:0000747",
          "name": "material sample",
          "value": "hTAG",
          "cvLabel": "OBI"
        },
        "dataType": {
          "accession": "OBI:0001755",
          "name": "selection criterion",
          "value": "All",
          "cvLabel": "OBI"
        }
      },
      "stats": {
        "n": 39,
        "mean": 3.818993618052202,
        "sd": 0.8532952142243078,
        "median": 3.8072647238556665,
        "cv": 22.343457454100516,
        "rcv": 11.58897348915045
      }
    },
    {
      "lipids": [
        "Cer 18:1;O2/24:1"
      ],
      "quantityUnit": {
        "accession": "UO:0000276",
        "name": "micromole per liter",
        "cvLabel": "UO"
      },
      "groupingAttributes": {
        "sampleMatrix": {
          "accession": "OBI:0000747",
          "name": "material sample",
          "value": "hTAG",
          "cvLabel": "OBI"
        },
        "dataType": {
          "accession": "OBI:0001755",
          "name": "selection criterion",
          "value": "All",
          "cvLabel": "OBI"
        }
      },
      "stats": {
        "n": 39,
        "mean": 1.318599872298002,
        "sd": 0.330735350137822,
        "median": 1.270114302380823,
        "cv": 25.082313223755282,
        "rcv": 11.60633793000615
      }
    }
  ],
  "visibility": "PUBLIC"
}